{
  "argv": [
    "python3",
    "probe.py"
  ],
  "definition_sha256": "0000000000000000000000000000000000000000000000000000000000000000",
  "evidence": [],
  "exit_code": 0,
  "implementation_profile_id": "triton_mlu",
  "observations": [
    {
      "capability_id": "memory.load.contiguous-fp32",
      "level": "observed",
      "numerically_checked": true
    }
  ],
  "observed_scope": {
    "dtype": "fp32",
    "layout": "contiguous",
    "shape": [
      "N"
    ]
  },
  "probe_id": "fixture-basic-memory-001",
  "profile_sha256": "0000000000000000000000000000000000000000000000000000000000000000",
  "runtime_fingerprint": "triton 3.6.0 / CoreX 4.4.0",
  "schema_version": 1,
  "target_id": "mlu590",
  "timed_out": false
}
